{
  "causation_id": "cause_example",
  "correlation_id": "cor_example",
  "data": {
    "changed_at": "2026-09-13T00:00:00Z",
    "reason": "PAYMENT_REVIEW",
    "status": "HELD"
  },
  "id": "evt_klyrow_account_held",
  "occurred_at": "2026-09-13T00:00:00Z",
  "source": "klyrow",
  "tenant_id": "tnt_example",
  "type": "klyrow.account.held",
  "version": 1
}
